file,ref_number,ref_text,doi,doi_url,titleDoi,firstAuthDoi,author_similarity,title_similarity
experiments/gene_essentiality_cancer/ai_messages/high_complexity--SDR9C7,[1],"Persson B, Kallberg Y, Bray JE, Bruford E, Dellaporta SL, Favia AD, Duarte RG, Jörnvall H, Kavanagh KL, Kedishvili N, Kisiela M, Maser E, Mindnich R, Orchard S, Penning TM, Thornton JM, Adamski J, Oppermann U. 2009. The SDR (short-chain dehydrogenase/reductase and related enzymes) nomenclature initiative. Chem Biol Interact. 178(1-3):94-8.",10.1016/j.cbi.2008.10.040,https://doi.org/10.1016/j.cbi.2008.10.040,The SDR (short-chain dehydrogenase/reductase and related enzymes) nomenclature initiative,Persson,100,100
experiments/gene_essentiality_cancer/ai_messages/high_complexity--SDR9C7,[2],"Kisiela M, Faust A, Ebert B, Maser E, Scheidig AJ. 2012. Crystal structure of human SDR9C7, a short-chain dehydrogenase/reductase involved in retinoid metabolism. Chem Biol Interact. 195(2):139-47.",10.2210/pdb5ojg/pdb,https://doi.org/10.2210/pdb5ojg/pdb,Crystal structure of the dehydrogenase/reductase SDR family member 4 (DHRS4) from Caenorhabditis elegans,Scheidig,100,60
experiments/gene_essentiality_cancer/ai_messages/high_complexity--SDR9C7,[3],"Bushue N, Wan YJ. 2010. Retinoid pathway and cancer therapeutics. Adv Drug Deliv Rev. 62(13):1285-98.",10.1016/j.addr.2010.07.003,https://doi.org/10.1016/j.addr.2010.07.003,Retinoid pathway and cancer therapeutics,Bushue,100,100
experiments/gene_essentiality_cancer/ai_messages/high_complexity--SDR9C7,[4],"Hart T, Chandrashekhar M, Aregger M, Steinhart Z, Brown KR, MacLeod G, Mis M, Zimmermann M, Fradet-Turcotte A, Sun S, Mero P, Dirks P, Sidhu S, Roth FP, Rissland OS, Durocher D, Angers S, Moffat J. 2015. High-Resolution CRISPR Screens Reveal Fitness Genes and Genotype-Specific Cancer Liabilities. Cell. 163(6):1515-26.",10.1016/j.cell.2015.11.015,https://doi.org/10.1016/j.cell.2015.11.015,High-Resolution CRISPR Screens Reveal Fitness Genes and Genotype-Specific Cancer Liabilities,Hart,100,100
experiments/gene_essentiality_cancer/ai_messages/high_complexity--SDR9C7,[5],"Meyers RM, Bryan JG, McFarland JM, Weir BA, Sizemore AE, Xu H, Dharia NV, Montgomery PG, Cowley GS, Pantel S, Goodale A, Lee Y, Ali LD, Jiang G, Lubonja R, Harrington WF, Strickland M, Wu T, Hawes DC, Zhivich VA, Wyatt MR, Kalani Z, Chang JJ, Okamoto M, Stegmaier K, Golub TR, Boehm JS, Vazquez F, Root DE, Hahn WC, Tsherniak A. 2017. Computational correction of copy number effect improves specificity of CRISPR-Cas9 essentiality screens in cancer cells. Nat Genet. 49(12):1779-1784.",10.1038/ng.3984,https://doi.org/10.1038/ng.3984,Computational correction of copy number effect improves specificity of CRISPR–Cas9 essentiality screens in cancer cells,Meyers,100,100
