file,ref_number,ref_text,doi,doi_url,titleDoi,firstAuthDoi,author_similarity,title_similarity
experiments/gene_essentiality_cancer/ai_messages/high_complexity--CCT5,[1],"Kubota H, Hynes G, Willison K. 1995. The chaperonin containing t-complex polypeptide 1 (TCP-1). Multisubunit machinery assisting in protein folding and assembly in the eukaryotic cytosol. Eur J Biochem. The eight-subunit chaperonin containing TCP-1.",10.1007/978-3-642-85252-7_11,https://doi.org/10.1007/978-3-642-85252-7_11,The chaperonin containing t-complex polypeptide 1 (TCP-1),Kubota,100,100
experiments/gene_essentiality_cancer/ai_messages/high_complexity--CCT5,[2],"Yokota S, Yanagi H, Yura T, Kubota H. 1999. Cytosolic chaperonin-containing t-complex polypeptide 1 changes the content of a particular subunit species concomitant with substrate binding and folding activities during the cell cycle. Eur J Biochem. Cell cycle-dependent expression of the chaperonin containing TCP-1.",10.1046/j.1432-1327.2001.02393.x,https://doi.org/10.1046/j.1432-1327.2001.02393.x,Cytosolic chaperonin‐containing t‐complex polypeptide 1 changes the content of a particular subunit species concomitant with substrate binding and folding activities during the cell cycle,Yokota,100,100
experiments/gene_essentiality_cancer/ai_messages/high_complexity--CCT5,[3],"Guest ST, Kratche ZR, Bollig-Fischer A, Haddad R, Ethier SP. 2015. Two members of the TRiC chaperonin complex, CCT2 and TCP1 are essential for survival of breast cancer cells and are linked to driving oncogenes. Exp Cell Res. Essentiality of TRiC/CCT subunits in breast cancer cells.",10.1016/j.yexcr.2015.02.005,https://doi.org/10.1016/j.yexcr.2015.02.005,"Two members of the TRiC chaperonin complex, CCT2 and TCP1 are essential for survival of breast cancer cells and are linked to driving oncogenes",Guest,100,100
experiments/gene_essentiality_cancer/ai_messages/high_complexity--CCT5,[4],"Hanahan D, Weinberg RA. 2011. Hallmarks of cancer: the next generation. Cell. The hallmarks of cancer.",10.1016/j.cell.2011.02.013,https://doi.org/10.1016/j.cell.2011.02.013,Hallmarks of Cancer: The Next Generation,Hanahan,100,100
experiments/gene_essentiality_cancer/ai_messages/high_complexity--CCT5,[5],"Fletcher DA, Mullins RD. 2010. Cell mechanics and the cytoskeleton. Nature. The role of the cytoskeleton in cell mechanics.",10.1038/nature08908,https://doi.org/10.1038/nature08908,Cell mechanics and the cytoskeleton,Fletcher,100,100
experiments/gene_essentiality_cancer/ai_messages/high_complexity--CCT5,[6],"Yam AY, Xia Y, Lin HT, Burlingame A, Gerstein M, Frydman J. 2008. Defining the TRiC/CCT interactome links chaperonin function to stabilization of newly made proteins with complex topologies. Nat Struct Mol Biol. The TRiC/CCT interactome and its role in protein folding.",10.1038/nsmb.1515,https://doi.org/10.1038/nsmb.1515,Defining the TRiC/CCT interactome links chaperonin function to stabilization of newly made proteins with complex topologies,Yam,100,100
