,file,ref_number,ref_text,doi,doi_url
0,experiments/sepsis_treatment/ai_messages/high_complexity--sepsis_hyperinflammation,[1],"Singer M, Deutschman CS, Seymour CW, et al. 2016. JAMA. The Third International Consensus Definitions for Sepsis and Septic Shock (Sepsis-3).",10.1001/jama.2016.0289,https://doi.org/10.1001/jama.2016.0289
1,experiments/sepsis_treatment/ai_messages/high_complexity--sepsis_hyperinflammation,[2],"Kell DB, Pretorius E. 2014. Front Pharmacol. Serum ferritin is an important inflammatory disease marker, as it is mainly a leakage product from damaged cells.",10.1039/c3mt00347g,https://doi.org/10.1039/c3mt00347g
2,experiments/sepsis_treatment/ai_messages/high_complexity--sepsis_hyperinflammation,[3],Ziegler-Heitbrock L. 2007. Immunobiology. The CD14+ CD16+ blood monocytes: their role in infection and inflammation.,10.1189/jlb.0806510,https://doi.org/10.1189/jlb.0806510
3,experiments/sepsis_treatment/ai_messages/high_complexity--sepsis_hyperinflammation,[4],"Docke WD, Randow F, Syrbe U, et al. 1997. Nat Med. Monocyte deactivation in septic patients: restoration by IFN-gamma treatment.",10.1038/nm0697-678,https://doi.org/10.1038/nm0697-678
4,experiments/sepsis_treatment/ai_messages/high_complexity--sepsis_hyperinflammation,[5],"Rhodes A, Evans LE, Alhazzani W, et al. 2017. Intensive Care Med. Surviving Sepsis Campaign: International Guidelines for Management of Sepsis and Septic Shock: 2016.",10.1007/s00134-008-1089-5,https://doi.org/10.1007/s00134-008-1089-5
5,experiments/sepsis_treatment/ai_messages/high_complexity--sepsis_hyperinflammation,[6],"Cecconi M, De Backer D, Antonelli M, et al. 2018. Intensive Care Med. Consensus on circulatory shock and hemodynamic monitoring. Task force of the European Society of Intensive Care Medicine.",10.1007/s00134-014-3525-z,https://doi.org/10.1007/s00134-014-3525-z
6,experiments/sepsis_treatment/ai_messages/high_complexity--sepsis_hyperinflammation,[7],"Annane D, Bellissant E, Bollaert PE, et al. 2009. JAMA. Corticosteroids in the treatment of severe sepsis and septic shock in adults: a systematic review.",10.1001/jama.2009.815,https://doi.org/10.1001/jama.2009.815
